{
  "id": "angeles-nf",
  "name": "Angeles National Forest",
  "description": "National Forest in CA",
  "location": {
    "lat": 34.3705,
    "lng": -118.0489,
    "state": "CA"
  },
  "geometry": {
    "type": "Polygon",
    "coordinates": [
      [
        [
          -117.74168413063883,
          34.39041480114097
        ],
        [
          -117.75437531967795,
          34.41548291524351
        ],
        [
          -117.76122902450899,
          34.479224914764714
        ],
        [
          -117.80973332535306,
          34.538586398518575
        ],
        [
          -117.91390742513094,
          34.56162799876861
        ],
        [
          -117.87140255144075,
          34.633809664425144
        ],
        [
          -118.01972593829979,
          34.678799027042636
        ],
        [
          -118.03300738176071,
          34.61839899578492
        ],
        [
          -118.14659330886394,
          34.62083953618228
        ],
        [
          -118.19421695782428,
          34.60864827116372
        ],
        [
          -118.24094233514953,
          34.52089122550743
        ],
        [
          -118.30008466429346,
          34.5693577123475
        ],
        [
          -118.33103021718495,
          34.521059392611676
        ],
        [
          -118.40173508027887,
          34.44822846255177
        ],
        [
          -118.41533760519424,
          34.4095469515602
        ],
        [
          -118.37286582825779,
          34.28041588193724
        ],
        [
          -118.32881679160126,
          34.251663989108835
        ],
        [
          -118.29312560100988,
          34.22000114923615
        ],
        [
          -118.26240496921517,
          34.14477574523064
        ],
        [
          -118.18493465997405,
          34.17649639922347
        ],
        [
          -118.08094217681767,
          34.06967216268826
        ],
        [
          -118.02652981337535,
          34.11637930080013
        ],
        [
          -117.97198381696391,
          34.141463446775944
        ],
        [
          -117.93032556310413,
          34.170526878037656
        ],
        [
          -117.81419776909682,
          34.15802197612824
        ],
        [
          -117.73385381279795,
          34.213581048010944
        ],
        [
          -117.7962900723948,
          34.26334127915736
        ],
        [
          -117.70655504240159,
          34.34754278660097
        ],
        [
          -117.74168413063883,
          34.39041480114097
        ]
      ]
    ]
  },
  "area": {
    "acres": 700176,
    "km2": 2833.51,
    "hectares": 283351.42
  },
  "designation": "National Forest",
  "metadata": {
    "source": "Conservation Connector Site Inventory",
    "lastUpdated": "2025-10-17",
    "dataQuality": "medium",
    "geometrySource": "Generated approximation based on area and center point",
    "approximateArea": true
  }
}
