{
  "id": "petrified-forest-np",
  "name": "Petrified Forest National Park",
  "description": "National Park in AZ",
  "location": {
    "lat": 34.9099,
    "lng": -109.7817,
    "state": "AZ"
  },
  "geometry": {
    "type": "Polygon",
    "coordinates": [
      [
        [
          -109.75969,
          35.17051
        ],
        [
          -109.68542,
          35.16973
        ],
        [
          -109.68598,
          35.13972
        ],
        [
          -109.68359,
          35.12552
        ],
        [
          -109.73529,
          35.12834
        ],
        [
          -109.73634,
          35.08301
        ],
        [
          -109.75454,
          35.08365
        ],
        [
          -109.75462,
          35.06652
        ],
        [
          -109.76379,
          35.06623
        ],
        [
          -109.76345,
          35.062
        ],
        [
          -109.7718,
          35.06139
        ],
        [
          -109.77143,
          35.0541
        ],
        [
          -109.79008,
          35.05433
        ],
        [
          -109.78954,
          35.03988
        ],
        [
          -109.73693,
          35.03983
        ],
        [
          -109.73665,
          35.07538
        ],
        [
          -109.71874,
          35.08068
        ],
        [
          -109.71894,
          35.0757
        ],
        [
          -109.71445,
          35.07569
        ],
        [
          -109.71473,
          35.06848
        ],
        [
          -109.66064,
          35.06837
        ],
        [
          -109.66058,
          35.07194
        ],
        [
          -109.65609,
          35.0719
        ],
        [
          -109.65603,
          35.07548
        ],
        [
          -109.65154,
          35.07544
        ],
        [
          -109.65144,
          35.08269
        ],
        [
          -109.59448,
          35.08245
        ],
        [
          -109.59447,
          35.05353
        ],
        [
          -109.57674,
          35.05347
        ],
        [
          -109.57684,
          35.03908
        ],
        [
          -109.59456,
          35.03922
        ],
        [
          -109.59576,
          34.92282
        ],
        [
          -109.667,
          34.92362
        ],
        [
          -109.66727,
          34.90893
        ],
        [
          -109.72036,
          34.90943
        ],
        [
          -109.72039,
          34.8948
        ],
        [
          -109.73772,
          34.89491
        ],
        [
          -109.73848,
          34.82205
        ],
        [
          -109.78099,
          34.82227
        ],
        [
          -109.78107,
          34.77962
        ],
        [
          -109.85141,
          34.77871
        ],
        [
          -109.85158,
          34.7933
        ],
        [
          -109.89588,
          34.79321
        ],
        [
          -109.89739,
          34.83714
        ],
        [
          -109.93398,
          34.83703
        ],
        [
          -109.94655,
          34.84382
        ],
        [
          -109.96851,
          34.8508
        ],
        [
          -109.96845,
          34.90972
        ],
        [
          -109.95078,
          34.90976
        ],
        [
          -109.95099,
          34.96587
        ],
        [
          -109.93347,
          34.96783
        ],
        [
          -109.93347,
          34.96427
        ],
        [
          -109.93184,
          34.96434
        ],
        [
          -109.92047,
          34.96727
        ],
        [
          -109.91562,
          34.96413
        ],
        [
          -109.91563,
          34.96798
        ],
        [
          -109.89778,
          34.96797
        ],
        [
          -109.89776,
          34.96377
        ],
        [
          -109.89173,
          34.96223
        ],
        [
          -109.88848,
          34.96606
        ],
        [
          -109.87982,
          34.96456
        ],
        [
          -109.87984,
          34.96795
        ],
        [
          -109.86185,
          34.96792
        ],
        [
          -109.8618,
          34.96372
        ],
        [
          -109.8597,
          34.96385
        ],
        [
          -109.85421,
          34.9659
        ],
        [
          -109.84934,
          34.96499
        ],
        [
          -109.84376,
          34.96629
        ],
        [
          -109.84387,
          34.97093
        ],
        [
          -109.82595,
          34.97628
        ],
        [
          -109.82589,
          34.97485
        ],
        [
          -109.82287,
          34.97511
        ],
        [
          -109.82279,
          34.97229
        ],
        [
          -109.82125,
          34.97232
        ],
        [
          -109.82138,
          34.97708
        ],
        [
          -109.82026,
          34.97585
        ],
        [
          -109.82021,
          34.97782
        ],
        [
          -109.81218,
          34.97891
        ],
        [
          -109.80752,
          34.98121
        ],
        [
          -109.80702,
          35.04032
        ],
        [
          -109.88017,
          35.04053
        ],
        [
          -109.88018,
          35.03329
        ],
        [
          -109.8846,
          35.03329
        ],
        [
          -109.88461,
          35.02604
        ],
        [
          -109.8802,
          35.02604
        ],
        [
          -109.88013,
          35.01151
        ],
        [
          -109.91572,
          35.01152
        ],
        [
          -109.91568,
          35.06953
        ],
        [
          -109.92461,
          35.06954
        ],
        [
          -109.92461,
          35.08404
        ],
        [
          -109.91565,
          35.08404
        ],
        [
          -109.91398,
          35.17029
        ],
        [
          -109.75969,
          35.17051
        ]
      ]
    ]
  },
  "area": {
    "acres": 221390,
    "km2": 895.93,
    "hectares": 89593.43
  },
  "designation": "National Park",
  "metadata": {
    "source": "Conservation Connector Site Inventory",
    "lastUpdated": "2025-10-17",
    "dataQuality": "high",
    "geometrySource": "National Park Service via PADUS 3.0"
  }
}
