{
  "id": "shoshone-nf",
  "name": "Shoshone National Forest",
  "description": "National Forest in WY",
  "location": {
    "lat": 44,
    "lng": -109.5,
    "state": "WY"
  },
  "geometry": {
    "type": "MultiPolygon",
    "coordinates": [
      [
        [
          [
            -109.44017495611571,
            43.51422204566902
          ],
          [
            -109.44432682665064,
            43.57366758011437
          ],
          [
            -109.49636145440758,
            43.638797978617795
          ],
          [
            -109.50261550392281,
            43.626224662287306
          ],
          [
            -109.60299369740896,
            43.609988121828074
          ],
          [
            -109.59830556578886,
            43.677905873320306
          ],
          [
            -109.60212605215426,
            43.79008126026253
          ],
          [
            -109.63468440070113,
            43.812664164325895
          ],
          [
            -109.8183501204836,
            43.775732980504976
          ],
          [
            -109.74644422272303,
            43.82882213864353
          ],
          [
            -109.92555563725068,
            43.87017083039011
          ],
          [
            -109.86377010955405,
            43.86204942602939
          ],
          [
            -110.03317335495834,
            43.838555211271476
          ],
          [
            -110.03682622809853,
            43.921581794083295
          ],
          [
            -110.17694887624361,
            43.83347081571454
          ],
          [
            -110.22462200897702,
            43.833915425721806
          ],
          [
            -110.23641295600616,
            43.82560315827401
          ],
          [
            -110.36678510928306,
            43.815322289532915
          ],
          [
            -110.26915654361093,
            43.72315434102479
          ],
          [
            -110.40724814849987,
            43.695684027824285
          ],
          [
            -110.36797185968324,
            43.63050280170474
          ],
          [
            -110.50098654211982,
            43.69434421602824
          ],
          [
            -110.41195679014493,
            43.56188415081076
          ],
          [
            -110.45376328958291,
            43.572880529929826
          ],
          [
            -110.48524214532375,
            43.520197352193634
          ],
          [
            -110.51262924899537,
            43.486132331859004
          ],
          [
            -110.42632222232547,
            43.47145802883048
          ],
          [
            -110.3847056420071,
            43.38927232041794
          ],
          [
            -110.36237675676101,
            43.39020601301233
          ],
          [
            -110.34082037763608,
            43.32533236338023
          ],
          [
            -110.31240887310527,
            43.30258038122313
          ],
          [
            -110.28465370399798,
            43.260271319566954
          ],
          [
            -110.20179882305098,
            43.23913248854179
          ],
          [
            -110.27591890844049,
            43.147779799623315
          ],
          [
            -110.13736026041191,
            43.14716939859786
          ],
          [
            -110.05840517147597,
            43.18393646854981
          ],
          [
            -110.06714465216857,
            43.13807316338836
          ],
          [
            -109.93417352925506,
            43.160211507196145
          ],
          [
            -109.89291092945356,
            43.21646726314686
          ],
          [
            -109.85943303913379,
            43.092717625328184
          ],
          [
            -109.83938130049943,
            43.12850031567972
          ],
          [
            -109.74864868018359,
            43.227680074366496
          ],
          [
            -109.70800044342238,
            43.25961563078926
          ],
          [
            -109.63403860371945,
            43.18529271499904
          ],
          [
            -109.63161392042534,
            43.24113768985821
          ],
          [
            -109.49460063587874,
            43.359677381809114
          ],
          [
            -109.52694587545147,
            43.41717738154898
          ],
          [
            -109.54496295803436,
            43.39028576400543
          ],
          [
            -109.54708276182183,
            43.41075621785357
          ],
          [
            -109.44017495611571,
            43.51422204566902
          ]
        ]
      ],
      [
        [
          [
            -109.01775252341966,
            43.96914944787022
          ],
          [
            -108.90992729889471,
            43.99387062331436
          ],
          [
            -108.94884107527507,
            44.10914264797298
          ],
          [
            -109.08063744240079,
            44.17501130692969
          ],
          [
            -109.08002949346331,
            44.13060450621617
          ],
          [
            -109.11352678703344,
            44.21074546932102
          ],
          [
            -109.25337125108662,
            44.23030955084057
          ],
          [
            -109.13669612531426,
            44.31714881459651
          ],
          [
            -109.22053801230324,
            44.25588126420178
          ],
          [
            -109.26543391013308,
            44.28878336174432
          ],
          [
            -109.41264938638801,
            44.37043650612942
          ],
          [
            -109.44044434187045,
            44.37155469435156
          ],
          [
            -109.4747961978853,
            44.36261587001916
          ],
          [
            -109.51183178372187,
            44.329805416478926
          ],
          [
            -109.63803601333039,
            44.41017188049137
          ],
          [
            -109.70086595283057,
            44.396732914024945
          ],
          [
            -109.73073416705624,
            44.25449702853478
          ],
          [
            -109.84651117424733,
            44.28848526237032
          ],
          [
            -109.75175975771373,
            44.228609645993444
          ],
          [
            -109.95767508188581,
            44.26002071323152
          ],
          [
            -109.86946816547288,
            44.23487404696353
          ],
          [
            -109.915747429768,
            44.155168067598424
          ],
          [
            -109.9772880858217,
            44.12895624286585
          ],
          [
            -109.98226575496116,
            44.02193656551392
          ],
          [
            -109.98489883747472,
            44.04964628830208
          ],
          [
            -109.90170452881125,
            44.00046094793504
          ],
          [
            -110.01953323570994,
            43.877463049550606
          ],
          [
            -109.94742598807413,
            43.89876933218839
          ],
          [
            -109.89556002119029,
            43.84716891238543
          ],
          [
            -109.93844065830648,
            43.74658339421129
          ],
          [
            -109.99219626227517,
            43.76428779938413
          ],
          [
            -109.84428685781415,
            43.79448957680086
          ],
          [
            -109.74266942765473,
            43.763609768540995
          ],
          [
            -109.77301336934295,
            43.70390640676335
          ],
          [
            -109.61406147568526,
            43.67727051364136
          ],
          [
            -109.60768879811366,
            43.63170383107137
          ],
          [
            -109.53526860624912,
            43.611731535945985
          ],
          [
            -109.46652315517612,
            43.630247160738314
          ],
          [
            -109.42023597037719,
            43.63277021730951
          ],
          [
            -109.35021482207272,
            43.71455010332387
          ],
          [
            -109.2479575567192,
            43.69623146199777
          ],
          [
            -109.24702581781682,
            43.674989271751166
          ],
          [
            -109.18189123712479,
            43.78393924238677
          ],
          [
            -109.21957532230792,
            43.74139037187293
          ],
          [
            -109.03181139259748,
            43.748067547442524
          ],
          [
            -109.05023450566472,
            43.813269480986875
          ],
          [
            -109.03102283428018,
            43.83056390660408
          ],
          [
            -108.96988077260443,
            43.876369259156185
          ],
          [
            -109.04462744719434,
            43.9576502276208
          ],
          [
            -109.01775252341966,
            43.96914944787022
          ]
        ]
      ]
    ]
  },
  "area": {
    "acres": 2433000,
    "km2": 9846.01,
    "hectares": 984601.04
  },
  "designation": "National Forest",
  "metadata": {
    "source": "Conservation Connector Site Inventory",
    "lastUpdated": "2025-10-17",
    "dataQuality": "medium",
    "geometrySource": "Generated approximation based on area and center point",
    "approximateArea": true
  }
}
