{
  "id": "flathead-nf",
  "name": "Flathead National Forest",
  "description": "National Forest in MT",
  "location": {
    "lat": 48.25,
    "lng": -113.75,
    "state": "MT"
  },
  "geometry": {
    "type": "MultiPolygon",
    "coordinates": [
      [
        [
          [
            -113.73657823591856,
            47.76817540396903
          ],
          [
            -113.65168983623772,
            47.78235998970199
          ],
          [
            -113.84653922163797,
            47.85276031968113
          ],
          [
            -113.72390616811144,
            47.8556806985462
          ],
          [
            -113.74312612888059,
            47.946939494784885
          ],
          [
            -113.89548824881521,
            47.91069669177265
          ],
          [
            -113.8275958946801,
            47.98067786153217
          ],
          [
            -113.93108236992252,
            48.04703544923363
          ],
          [
            -114.05093908225956,
            48.00390132981414
          ],
          [
            -113.99588584265854,
            48.03643938466281
          ],
          [
            -114.0738437365059,
            48.0961497239803
          ],
          [
            -114.12791683841363,
            48.07513910788244
          ],
          [
            -114.20850474426032,
            48.04174124631324
          ],
          [
            -114.3402202374048,
            48.079629298907584
          ],
          [
            -114.41013074593249,
            48.12703698700179
          ],
          [
            -114.45999549509081,
            48.06374236262138
          ],
          [
            -114.45175214800658,
            48.07749671045031
          ],
          [
            -114.51815589020818,
            48.00701623391196
          ],
          [
            -114.55226091515067,
            47.970938602356746
          ],
          [
            -114.68603519372279,
            47.98580900822072
          ],
          [
            -114.73729958960926,
            47.979003999090075
          ],
          [
            -114.84286506348401,
            47.84951726279369
          ],
          [
            -114.67865971405695,
            47.84394108272864
          ],
          [
            -114.85307621769788,
            47.82397298865161
          ],
          [
            -114.85636959934149,
            47.77699603652836
          ],
          [
            -114.75803527141152,
            47.75215931045964
          ],
          [
            -114.82183404554144,
            47.61676269420715
          ],
          [
            -114.69348543926205,
            47.64201787219139
          ],
          [
            -114.72808010335959,
            47.51379604240398
          ],
          [
            -114.6388893722193,
            47.5825906230632
          ],
          [
            -114.53405495910175,
            47.51666894636093
          ],
          [
            -114.66912425088367,
            47.43632840973434
          ],
          [
            -114.5244065902409,
            47.44788346434808
          ],
          [
            -114.53487773511517,
            47.37326740821106
          ],
          [
            -114.37149518888822,
            47.37254782883869
          ],
          [
            -114.24845708909152,
            47.3542275418092
          ],
          [
            -114.19965743623894,
            47.395162682918624
          ],
          [
            -114.13473479552601,
            47.42938068685338
          ],
          [
            -114.06673946484014,
            47.425358089087
          ],
          [
            -114.0219796191976,
            47.49168366835237
          ],
          [
            -113.89837264785697,
            47.44563051381205
          ],
          [
            -113.89195130573061,
            47.440631884157504
          ],
          [
            -113.86634536405718,
            47.55696858126404
          ],
          [
            -113.83260548225496,
            47.588411033580776
          ],
          [
            -113.75293252277956,
            47.60753745915245
          ],
          [
            -113.82304682422854,
            47.67198316774147
          ],
          [
            -113.69525234180446,
            47.681837021019554
          ],
          [
            -113.72729561790673,
            47.67381297254208
          ],
          [
            -113.73657823591856,
            47.76817540396903
          ]
        ]
      ],
      [
        [
          [
            -113.22037834135567,
            48.234069608552716
          ],
          [
            -113.14572914710747,
            48.27953825005842
          ],
          [
            -113.34092018057659,
            48.35566510023951
          ],
          [
            -113.34175436145586,
            48.38031218333614
          ],
          [
            -113.25668356757681,
            48.41664955029441
          ],
          [
            -113.31624664914064,
            48.4138101512921
          ],
          [
            -113.36365416405633,
            48.54877478918779
          ],
          [
            -113.48465543939245,
            48.54110829722233
          ],
          [
            -113.50846131190143,
            48.54578076788832
          ],
          [
            -113.55170651977359,
            48.591434354373305
          ],
          [
            -113.66686228483061,
            48.6703938601161
          ],
          [
            -113.6698448545995,
            48.65793393909935
          ],
          [
            -113.75837220414107,
            48.59162242002447
          ],
          [
            -113.7825472631048,
            48.645091444126756
          ],
          [
            -113.90207923193525,
            48.63262995175077
          ],
          [
            -113.94815542313205,
            48.516604714978214
          ],
          [
            -113.94482363196715,
            48.51383872115683
          ],
          [
            -114.07717433761603,
            48.504465054281674
          ],
          [
            -114.1860600928266,
            48.497287588233064
          ],
          [
            -114.09782730326843,
            48.46397192490584
          ],
          [
            -114.21005236185133,
            48.49075373449993
          ],
          [
            -114.16639529866744,
            48.37447731064785
          ],
          [
            -114.25370238855771,
            48.395911718040445
          ],
          [
            -114.22614235406746,
            48.292588301588594
          ],
          [
            -114.37381033845121,
            48.31255783909144
          ],
          [
            -114.1849703098941,
            48.23991043174928
          ],
          [
            -114.22308474319394,
            48.148574910331284
          ],
          [
            -114.17847323993382,
            48.17718271651571
          ],
          [
            -114.2801985956177,
            48.03962228067656
          ],
          [
            -114.07190741920965,
            48.03588734034672
          ],
          [
            -114.0540882995471,
            48.010333666395624
          ],
          [
            -114.15327496586403,
            47.93243176540313
          ],
          [
            -113.92046933149649,
            47.984775454096955
          ],
          [
            -113.89523032957692,
            47.98387857777562
          ],
          [
            -113.8965439811882,
            47.976134154477535
          ],
          [
            -113.79523834851376,
            47.91883440904227
          ],
          [
            -113.6763466048029,
            47.87396447981172
          ],
          [
            -113.6125563272759,
            47.89943689641921
          ],
          [
            -113.57659811682056,
            47.975599601886906
          ],
          [
            -113.56741653643347,
            47.97661083525368
          ],
          [
            -113.40651878105804,
            47.95401392422048
          ],
          [
            -113.43671768470283,
            48.033000335793076
          ],
          [
            -113.46268786721856,
            48.031538521174326
          ],
          [
            -113.33391580910119,
            48.0955812594254
          ],
          [
            -113.24547357108659,
            48.090338944673526
          ],
          [
            -113.34375704227799,
            48.147843662344435
          ],
          [
            -113.2333737001626,
            48.1112575260164
          ],
          [
            -113.13043518477332,
            48.2491714222127
          ],
          [
            -113.22037834135567,
            48.234069608552716
          ]
        ]
      ]
    ]
  },
  "area": {
    "acres": 2404935,
    "km2": 9732.44,
    "hectares": 973243.53
  },
  "designation": "National Forest",
  "metadata": {
    "source": "Conservation Connector Site Inventory",
    "lastUpdated": "2025-10-17",
    "dataQuality": "medium",
    "geometrySource": "Generated approximation based on area and center point",
    "approximateArea": true
  }
}
