{
  "id": "sam-houston-nf",
  "name": "Sam Houston National Forest",
  "description": "National Forest in TX",
  "location": {
    "lat": 30.5333,
    "lng": -95.3,
    "state": "TX"
  },
  "geometry": {
    "type": "Polygon",
    "coordinates": [
      [
        [
          -95.12531525457143,
          30.53381660036513
        ],
        [
          -95.13515365574692,
          30.591417449375978
        ],
        [
          -95.15036745461711,
          30.61261563182405
        ],
        [
          -95.21102258453038,
          30.622911610878013
        ],
        [
          -95.22590881775757,
          30.669039005355707
        ],
        [
          -95.26269436389266,
          30.6457475025718
        ],
        [
          -95.30412679733989,
          30.674540107974085
        ],
        [
          -95.3420709475329,
          30.63827712627042
        ],
        [
          -95.38528638318499,
          30.664612536289965
        ],
        [
          -95.39835531744754,
          30.64301067527374
        ],
        [
          -95.45009641439839,
          30.603479369291666
        ],
        [
          -95.46544346455052,
          30.578070175714686
        ],
        [
          -95.42914581086056,
          30.527650797841943
        ],
        [
          -95.43069920961743,
          30.49743070382166
        ],
        [
          -95.42165575755382,
          30.44987385671931
        ],
        [
          -95.39491869521898,
          30.463590157806795
        ],
        [
          -95.35942177402613,
          30.427121662183563
        ],
        [
          -95.325430281345,
          30.427671965627162
        ],
        [
          -95.29045087116032,
          30.389722116049274
        ],
        [
          -95.23000969657453,
          30.391252944558012
        ],
        [
          -95.20665671080492,
          30.40262092086218
        ],
        [
          -95.20993786595955,
          30.443992765555375
        ],
        [
          -95.17486264677136,
          30.47494798223939
        ],
        [
          -95.13448763762761,
          30.494359214893883
        ],
        [
          -95.12531525457143,
          30.53381660036513
        ]
      ]
    ]
  },
  "area": {
    "acres": 163000,
    "km2": 659.64,
    "hectares": 65963.82
  },
  "designation": "National Forest",
  "metadata": {
    "source": "Conservation Connector Site Inventory",
    "lastUpdated": "2025-10-17",
    "dataQuality": "medium",
    "geometrySource": "Generated approximation based on area and center point",
    "approximateArea": true
  }
}
