{
  "id": "big-cypress-national-preserve",
  "name": "Big Cypress National Preserve",
  "description": "National Preserve in FL",
  "location": {
    "lat": 25.9739,
    "lng": -81.0811,
    "state": "FL"
  },
  "geometry": {
    "type": "Polygon",
    "coordinates": [
      [
        [
          -80.81514984680699,
          25.941653730095474
        ],
        [
          -80.75481678222815,
          26.044699198740865
        ],
        [
          -80.85645552707174,
          26.069783001186043
        ],
        [
          -80.87153430343537,
          26.105516507998857
        ],
        [
          -80.83113510104505,
          26.201087311807875
        ],
        [
          -80.93397582084036,
          26.203217181865885
        ],
        [
          -80.99575786587913,
          26.276728418190775
        ],
        [
          -81.07325610577283,
          26.27435693920796
        ],
        [
          -81.10456613053576,
          26.26752776378952
        ],
        [
          -81.1659611666008,
          26.21212772011061
        ],
        [
          -81.23052632430576,
          26.160493032539932
        ],
        [
          -81.31268538031432,
          26.13837216238509
        ],
        [
          -81.33019782282487,
          26.12272849899522
        ],
        [
          -81.3915359556612,
          26.07103414204361
        ],
        [
          -81.43036288739988,
          26.010615469479223
        ],
        [
          -81.41766839663725,
          25.939078597479945
        ],
        [
          -81.3669197619149,
          25.919987091683726
        ],
        [
          -81.30523570723692,
          25.85286394601456
        ],
        [
          -81.3609476136214,
          25.795522447952813
        ],
        [
          -81.29106260644646,
          25.734196480460945
        ],
        [
          -81.19173157022382,
          25.74498067307575
        ],
        [
          -81.1463845699353,
          25.75414021182847
        ],
        [
          -81.06294411358873,
          25.66084335106535
        ],
        [
          -81.02699351610904,
          25.704440888597095
        ],
        [
          -80.90764499133927,
          25.692465472034954
        ],
        [
          -80.86974934440944,
          25.80448466553601
        ],
        [
          -80.84625566300524,
          25.760082544121637
        ],
        [
          -80.83139225008928,
          25.906443355610776
        ],
        [
          -80.79290335199659,
          25.936463947916543
        ],
        [
          -80.81514984680699,
          25.941653730095474
        ]
      ]
    ]
  },
  "area": {
    "acres": 729000,
    "km2": 2950.16,
    "hectares": 295016.09
  },
  "designation": "National Preserve",
  "metadata": {
    "source": "Conservation Connector Site Inventory",
    "lastUpdated": "2025-10-17",
    "dataQuality": "medium",
    "geometrySource": "Generated approximation based on area and center point",
    "approximateArea": true
  }
}
